{
  "schema_version": "TELEMETRY_COVERAGE_CONTRACT_V0",
  "contract_status": "VALIDATION_CONTRACT_ENFORCED",
  "public_safe_status": "NOT_PUBLIC_SAFE",
  "runtime_active": false,
  "signal_observed": false,
  "human_review_required": true,
  "lanes": [
    {
      "detection_id": "HO-NDR-001",
      "coverage_family": "ndr_visibility_boundary",
      "source_truth": "BOUNDARY_CONTRACT_ONLY",
      "validation_state": "VALIDATION_CONTRACT_ENFORCED",
      "proof_ceiling": "BOUNDARY_CONTRACT_ONLY",
      "public_safe_status": "NOT_PUBLIC_SAFE",
      "runtime_active": false,
      "signal_observed": false,
      "validation_owner": "hawkinsoperations-validation",
      "platform_contract_role": "NDR visibility and cross-source corroboration boundary contract only.",
      "supported_claim": "HO-NDR-001 validation contracts enforce sanitized visibility and cross-source corroboration shape without packet, route, signal, runtime, or public proof claims.",
      "blocked_claims": [
        "runtime-active",
        "signal-observed",
        "live Splunk",
        "Cribl-routed proof",
        "Wazuh-routed proof",
        "Security Onion observed proof",
        "production-ready",
        "public-safe runtime",
        "autonomous SOC",
        "AI-approved",
        "analyst-approved"
      ],
      "next_gate": "Runtime capture, evidence-link review, proof update, and public-safe review require separate approval."
    },
    {
      "detection_id": "HO-PIPE-001",
      "coverage_family": "pipeline_route_integrity",
      "source_truth": "SOURCE_EXISTS",
      "validation_state": "VALIDATION_CONTRACT_ENFORCED",
      "proof_ceiling": "SOURCE_EXISTS",
      "public_safe_status": "NOT_PUBLIC_SAFE",
      "runtime_active": false,
      "signal_observed": false,
      "validation_owner": "hawkinsoperations-validation",
      "platform_contract_role": "Pipeline route integrity and field-preservation contract only.",
      "supported_claim": "HO-PIPE-001 validation contracts enforce source-controlled route-integrity shape and required field preservation without traffic delivery, route proof, signal, runtime, or public proof claims.",
      "blocked_claims": [
        "runtime-active",
        "signal-observed",
        "live Splunk",
        "Cribl-routed proof",
        "Wazuh-routed proof",
        "Security Onion observed proof",
        "production-ready",
        "public-safe runtime",
        "autonomous SOC",
        "AI-approved",
        "analyst-approved"
      ],
      "next_gate": "Proof index, runtime route, signal correlation, and public-safe wording require separate approval."
    }
  ],
  "blocked_claims": [
    "runtime-active",
    "signal-observed",
    "live Splunk",
    "Cribl-routed proof",
    "Wazuh-routed proof",
    "Security Onion observed proof",
    "production-ready",
    "public-safe runtime",
    "autonomous SOC",
    "AI-approved",
    "analyst-approved"
  ],
  "claim_boundary": "Telemetry coverage contract validation is platform contract truth only. It does not prove runtime-active status, signal-observed status, live Splunk, Cribl-routed proof, Wazuh-routed proof, Security Onion observed proof, production-ready status, public-safe runtime status, autonomous SOC behavior, AI-approved status, or analyst-approved status.",
  "next_gate": "Human review, proof repository follow-up, workflow follow-up, runtime approval, evidence-link review, and public-safe review remain separate scopes."
}
